{
	"planCostShares": {
			"deductible": 2000,
			"_org": "example.com",
			"copay": 23,
			"objectId": "1234vxc2324sdf-501",
			"objectType": "membercostshare"
	},
	"linkedPlanServices": [{
	"linkedService": {
		"_org": "example.com",
		"objectId": "1234520xvc30sfs-505abc",
		"objectType": "service",
		"name": "well baby"
	},
	"planserviceCostShares": {
		"deductible": 10,
		"_org": "example.com",
		"copay": 175,
		"objectId": "1234512xvc1314sdfsd-506abc",
		"objectType": "membercostshare"
	},
	"_org": "example.com",
	"objectId": "27283xvx9sdf-507abc",
	"objectType": "planservice"
}],

"_org": "example.com",
"objectId": "12xvxc345ssdsds-508",
"objectType": "plan",
"planType": "inNetwork",
"creationDate": "12-12-2017"
}